{"slug":"n8n-master","name":"n8n Master","category":"development","tagline":"Builds and ships n8n workflow JSON straight to a live instance from chat","description":"Describe the automation you want and it writes the workflow definition, then pushes it at your instance to see whether it actually runs. Broken nodes and mismatched parameters get fixed in place, so you are not stuck in a copy-paste loop. Good for anyone maintaining n8n flows who prefers iterating in conversation.","integrations":[],"add":{"kind":"share-link","url":"https://x.ai/bot/Zvqbrq6yN68ijhEpRz0lU","hint":null},"instructions":null,"source":"https://x.ai/bot/Zvqbrq6yN68ijhEpRz0lU","homepage":"https://x.ai/bot/Zvqbrq6yN68ijhEpRz0lU","license":null,"author":"PixelRainbowNFT","tags":["development","developer","business","automation","engineering","data","on-demand"],"verified":false,"added":"2026-09-21","notes":"Native Grok Bot share. Third-party bot; not from xAI."}
