{
  "slug": "influence",
  "name": "Influence",
  "category": "personal",
  "tagline": "Study Cialdini's persuasion classic and learn to spot the tricks aimed at you",
  "description": "Think through the ideas in Robert Cialdini's Influence with a companion that has read the same book. It works best as a discussion partner: check that you can explain each principle in your own words, trace where it shows up in the wild, and practise spotting the attempts aimed at you. Notes stay yours.",
  "integrations": [],
  "add": {
    "kind": "share-link",
    "url": "https://x.ai/bot/TLwZuWy1y7meri_GT4EQw",
    "hint": null
  },
  "instructions": null,
  "source": "https://x.ai/bot/TLwZuWy1y7meri_GT4EQw",
  "homepage": "https://x.ai/bot/TLwZuWy1y7meri_GT4EQw",
  "license": null,
  "author": "CardCaptain",
  "tags": [
    "learning",
    "business",
    "marketer",
    "personal"
  ],
  "verified": false,
  "added": "2026-10-05",
  "notes": "Native Grok Bot share. Third-party bot; not from xAI."
}
